[
  {
    "norad_id": 10316,
    "name": "ONEWEB-4572",
    "tle_line1": "1 10316U 26001A  26237.12921781 .0000090  00000-0  10000-3 0  999   4",
    "tle_line2": "2 10316  63.3156 297.5197 1337054  70.7155 264.0761 12.12246376198823",
    "epoch": "2026-08-25T03:06:04Z",
    "epoch_age_hours": 29.9,
    "object_type": "PAYLOAD",
    "rcs_size": "SMALL",
    "radius_m": 0.5,
    "perigee_km": 861.3,
    "apogee_km": 883.1,
    "inclination_deg": 63.3156
  },
  {
    "norad_id": 10829,
    "name": "THOR ABLESTAR DEB 502",
    "tle_line1": "1 10829U 26001A  26237.87012045 .0000021  00000-0  10000-4 0  999   4",
    "tle_line2": "2 10829  96.9597 263.1694 0403324 306.6167 299.0632 15.17787247690873",
    "epoch": "2026-08-25T20:52:58Z",
    "epoch_age_hours": 12.1,
    "object_type": "DEBRIS",
    "rcs_size": "SMALL",
    "radius_m": 0.5,
    "perigee_km": 633.6,
    "apogee_km": 795.2,
    "inclination_deg": 96.9597
  },
  {
    "norad_id": 11220,
    "name": "CZ-4C DEB 32",
    "tle_line1": "1 11220U 26001A  26237.59350008 .0000074  00000-0  10000-3 0  999   0",
    "tle_line2": "2 11220  96.1728 104.7597 0697587 183.7483 142.8427 13.93290731968582",
    "epoch": "2026-08-25T14:14:38Z",
    "epoch_age_hours": 18.8,
    "object_type": "DEBRIS",
    "rcs_size": "MEDIUM",
    "radius_m": 2.5,
    "perigee_km": 1164.0,
    "apogee_km": 1237.1,
    "inclination_deg": 96.1728
  },
  {
    "norad_id": 11253,
    "name": "GAOFEN-2074",
    "tle_line1": "1 11253U 26001A  26238.28690972 .0000063  00000-0  10000-4 0  999   9",
    "tle_line2": "2 11253  94.2222 238.3092 0980697   7.1070 248.3099 14.97872093598407",
    "epoch": "2026-08-26T06:53:08Z",
    "epoch_age_hours": 2.1,
    "object_type": "PAYLOAD",
    "rcs_size": "SMALL",
    "radius_m": 0.5,
    "perigee_km": 1270.4,
    "apogee_km": 1321.5,
    "inclination_deg": 94.2222
  },
  {
    "norad_id": 11279,
    "name": "OBJECT 11279",
    "tle_line1": "1 11279U 26001A  26237.76123572 .0000055  00000-0  10000-5 0  999   8",
    "tle_line2": "2 11279  99.1070 291.8482 0422118 291.1154 169.8064 13.14651730405085",
    "epoch": "2026-08-25T18:16:10Z",
    "epoch_age_hours": 14.7,
    "object_type": "UNKNOWN",
    "rcs_size": "UNKNOWN",
    "radius_m": 1.0,
    "perigee_km": 687.7,
    "apogee_km": 741.8,
    "inclination_deg": 99.107
  },
  {
    "norad_id": 11566,
    "name": "GLOBALSTAR-1078",
    "tle_line1": "1 11566U 26001A  26229.35024950 .0000062  00000-0  10000-5 0  999   1",
    "tle_line2": "2 11566  95.4678 100.7371 0066806  83.3301 304.3815 11.56949394588234",
    "epoch": "2026-08-17T08:24:21Z",
    "epoch_age_hours": 216.6,
    "object_type": "PAYLOAD",
    "rcs_size": "LARGE",
    "radius_m": 10.0,
    "perigee_km": 1382.3,
    "apogee_km": 1466.2,
    "inclination_deg": 95.4678
  },
  {
    "norad_id": 11682,
    "name": "ARIANE 44 DEB 694",
    "tle_line1": "1 11682U 26001A  26237.01197369 .0000074  00000-0  10000-5 0  999   0",
    "tle_line2": "2 11682  54.7074 281.7487 0521458 154.2161 133.4055 17.91922176547258",
    "epoch": "2026-08-25T00:17:14Z",
    "epoch_age_hours": 32.7,
    "object_type": "DEBRIS",
    "rcs_size": "UNKNOWN",
    "radius_m": 1.0,
    "perigee_km": 431.7,
    "apogee_km": 3832.9,
    "inclination_deg": 54.7074
  },
  {
    "norad_id": 11897,
    "name": "GAOFEN-3531",
    "tle_line1": "1 11897U 26001A  26237.89872834 .0000016  00000-0  10000-3 0  999   5",
    "tle_line2": "2 11897   3.5102 112.1895 0487249 338.9067 214.6406 13.78704638306320",
    "epoch": "2026-08-25T21:34:10Z",
    "epoch_age_hours": 11.4,
    "object_type": "PAYLOAD",
    "rcs_size": "LARGE",
    "radius_m": 10.0,
    "perigee_km": 446.3,
    "apogee_km": 552.4,
    "inclination_deg": 3.5102
  },
  {
    "norad_id": 11913,
    "name": "FENGYUN 1C DEB 461",
    "tle_line1": "1 11913U 26001A  26238.14460938 .0000059  00000-0  10000-5 0  999   0",
    "tle_line2": "2 11913   3.8884 241.4525 0734736 347.7299 112.8255 11.45581988614513",
    "epoch": "2026-08-26T03:28:14Z",
    "epoch_age_hours": 5.5,
    "object_type": "DEBRIS",
    "rcs_size": "SMALL",
    "radius_m": 0.5,
    "perigee_km": 1189.5,
    "apogee_km": 1296.9,
    "inclination_deg": 3.8884
  },
  {
    "norad_id": 11923,
    "name": "COSMOS-3228",
    "tle_line1": "1 11923U 26001A  26238.08898598 .0000015  00000-0  10000-3 0  999   1",
    "tle_line2": "2 11923   2.6295 206.6084 1084444  82.2256 183.1770 11.41161966420535",
    "epoch": "2026-08-26T02:08:08Z",
    "epoch_age_hours": 6.9,
    "object_type": "PAYLOAD",
    "rcs_size": "MEDIUM",
    "radius_m": 2.5,
    "perigee_km": 874.6,
    "apogee_km": 988.0,
    "inclination_deg": 2.6295
  },
  {
    "norad_id": 12423,
    "name": "STARLINK-2634",
    "tle_line1": "1 12423U 26001A  26237.58516572 .0000066  00000-0  10000-4 0  999   7",
    "tle_line2": "2 12423   3.1560 119.4929 0187588 132.4869 320.2151 14.46319311544385",
    "epoch": "2026-08-25T14:02:38Z",
    "epoch_age_hours": 19.0,
    "object_type": "PAYLOAD",
    "rcs_size": "LARGE",
    "radius_m": 10.0,
    "perigee_km": 1141.0,
    "apogee_km": 1179.2,
    "inclination_deg": 3.156
  },
  {
    "norad_id": 12638,
    "name": "ONEWEB-3728",
    "tle_line1": "1 12638U 26001A  26236.47743586 .0000012  00000-0  10000-4 0  999   0",
    "tle_line2": "2 12638  68.9313 298.1842 0798977 255.1463 107.9246 14.68186726534166",
    "epoch": "2026-08-24T11:27:30Z",
    "epoch_age_hours": 45.5,
    "object_type": "PAYLOAD",
    "rcs_size": "LARGE",
    "radius_m": 10.0,
    "perigee_km": 520.6,
    "apogee_km": 718.8,
    "inclination_deg": 68.9313
  },
  {
    "norad_id": 13013,
    "name": "DELTA 2 R/B",
    "tle_line1": "1 13013U 26001A  26232.72214068 .0000038  00000-0  10000-5 0  999   9",
    "tle_line2": "2 13013  96.0623 205.7529 0179981 242.3973  18.9620 17.12998498160192",
    "epoch": "2026-08-20T17:19:52Z",
    "epoch_age_hours": 135.7,
    "object_type": "ROCKET_BODY",
    "rcs_size": "LARGE",
    "radius_m": 10.0,
    "perigee_km": 585.7,
    "apogee_km": 635.4,
    "inclination_deg": 96.0623
  },
  {
    "norad_id": 13282,
    "name": "ONEWEB-1323",
    "tle_line1": "1 13282U 26001A  26236.38915641 .0000053  00000-0  10000-3 0  999   3",
    "tle_line2": "2 13282   3.6021 343.8321 0403195 263.9045 134.1440 17.47263809249206",
    "epoch": "2026-08-24T09:20:23Z",
    "epoch_age_hours": 47.7,
    "object_type": "PAYLOAD",
    "rcs_size": "LARGE",
    "radius_m": 10.0,
    "perigee_km": 360.2,
    "apogee_km": 387.8,
    "inclination_deg": 3.6021
  },
  {
    "norad_id": 13525,
    "name": "GLOBALSTAR-2663",
    "tle_line1": "1 13525U 26001A  26235.04669865 .0000032  00000-0  10000-5 0  999   8",
    "tle_line2": "2 13525  68.2998 105.9040 0266961 245.7572  67.3116 14.85715929773508",
    "epoch": "2026-08-23T01:07:14Z",
    "epoch_age_hours": 79.9,
    "object_type": "PAYLOAD",
    "rcs_size": "MEDIUM",
    "radius_m": 2.5,
    "perigee_km": 1142.9,
    "apogee_km": 1252.2,
    "inclination_deg": 68.2998
  },
  {
    "norad_id": 13794,
    "name": "COSMOS-1950",
    "tle_line1": "1 13794U 26001A  26231.67294451 .0000044  00000-0  10000-5 0  999   9",
    "tle_line2": "2 13794  51.5465 259.4756 0251277  45.6950 281.2046 14.13194841254733",
    "epoch": "2026-08-19T16:09:02Z",
    "epoch_age_hours": 160.9,
    "object_type": "PAYLOAD",
    "rcs_size": "MEDIUM",
    "radius_m": 2.5,
    "perigee_km": 1086.6,
    "apogee_km": 1119.3,
    "inclination_deg": 51.5465
  },
  {
    "norad_id": 13994,
    "name": "COSMOS 2251 DEB 52",
    "tle_line1": "1 13994U 26001A  26237.43110927 .0000082  00000-0  10000-5 0  999   8",
    "tle_line2": "2 13994  54.2636 208.4109 0060572  29.5140 236.6543 15.84837705514679",
    "epoch": "2026-08-25T10:20:47Z",
    "epoch_age_hours": 22.7,
    "object_type": "DEBRIS",
    "rcs_size": "SMALL",
    "radius_m": 0.5,
    "perigee_km": 220.4,
    "apogee_km": 3667.7,
    "inclination_deg": 54.2636
  },
  {
    "norad_id": 14575,
    "name": "COSMOS-3784",
    "tle_line1": "1 14575U 26001A  26238.01488393 .0000040  00000-0  10000-5 0  999   8",
    "tle_line2": "2 14575  85.9711 135.7956 1399345 313.0566 353.0789 14.05149071601968",
    "epoch": "2026-08-26T00:21:25Z",
    "epoch_age_hours": 8.6,
    "object_type": "PAYLOAD",
    "rcs_size": "LARGE",
    "radius_m": 10.0,
    "perigee_km": 1258.5,
    "apogee_km": 1347.8,
    "inclination_deg": 85.9711
  },
  {
    "norad_id": 14800,
    "name": "GLOBALSTAR-5571",
    "tle_line1": "1 14800U 26001A  26237.71877542 .0000074  00000-0  10000-3 0  999   8",
    "tle_line2": "2 14800  64.0763 272.1458 0878826 252.3175  26.1322 16.09174679479897",
    "epoch": "2026-08-25T17:15:02Z",
    "epoch_age_hours": 15.8,
    "object_type": "PAYLOAD",
    "rcs_size": "SMALL",
    "radius_m": 0.5,
    "perigee_km": 367.7,
    "apogee_km": 502.4,
    "inclination_deg": 64.0763
  },
  {
    "norad_id": 14894,
    "name": "FENGYUN 1C DEB 799",
    "tle_line1": "1 14894U 26001A  26238.21855506 .0000051  00000-0  10000-3 0  999   8",
    "tle_line2": "2 14894  64.4957 246.9797 1239753 250.8761  14.5187 13.78807689219551",
    "epoch": "2026-08-26T05:14:43Z",
    "epoch_age_hours": 3.8,
    "object_type": "DEBRIS",
    "rcs_size": "MEDIUM",
    "radius_m": 2.5,
    "perigee_km": 568.0,
    "apogee_km": 629.7,
    "inclination_deg": 64.4957
  },
  {
    "norad_id": 14903,
    "name": "ARIANE 44 R/B",
    "tle_line1": "1 14903U 26001A  26235.91129643 .0000039  00000-0  10000-5 0  999   7",
    "tle_line2": "2 14903  97.0468 222.2854 0352920 246.3838 103.4564 13.16406405218467",
    "epoch": "2026-08-23T21:52:16Z",
    "epoch_age_hours": 59.1,
    "object_type": "ROCKET_BODY",
    "rcs_size": "MEDIUM",
    "radius_m": 2.5,
    "perigee_km": 1351.8,
    "apogee_km": 1477.2,
    "inclination_deg": 97.0468
  },
  {
    "norad_id": 15616,
    "name": "THOR ABLESTAR DEB 555",
    "tle_line1": "1 15616U 26001A  26238.04707228 .0000083  00000-0  10000-5 0  999   6",